{
  "format": "atlas.graphe/1",
  "titre": "Fontaine de chaîne (effet Mould)",
  "resume": "Pourquoi une chaîne tirée d’un bécher s’élève au-dessus du bord : réaction du tas au point de prise, h₁/h₂ = α/(1 − α − β). Mesures illustratives.",
  "sous_problemes": [
    {
      "id": "cadre",
      "nom": "Cadre et modélisation",
      "resume": "Principes, hypothèses et choix de modélisation de la chaîne."
    },
    {
      "id": "dyn",
      "nom": "SP1 · Chaîne en mouvement stationnaire",
      "resume": "Équation du mouvement, tension effective, forme."
    },
    {
      "id": "bords",
      "nom": "SP2 · Conditions aux extrémités",
      "resume": "Tension au point de prise (α), à l’arrivée au sol (β), au sommet."
    },
    {
      "id": "pred",
      "nom": "SP3 · Prédictions et confrontation",
      "resume": "Loi h₁/h₂, vitesse, estimation de α sur les mesures."
    },
    {
      "id": "billes",
      "nom": "Piste abandonnée · élan seul",
      "resume": "Une chaîne sans réaction du tas (α = 0) ne fait pas de fontaine.",
      "abandonne": true
    }
  ],
  "noeuds": [
    {
      "id": "ax_newton",
      "type": "axiome",
      "nom": "Bilan de quantité de mouvement (système ouvert)",
      "enonce": "Sur un volume de contrôle traversé par la chaîne : d𝐩/dt = Σ𝐅_ext + flux entrant de quantité de mouvement − flux sortant.",
      "sous_probleme": "cadre",
      "origine": "humain",
      "admis": true,
      "source": "Mécanique classique : bilan sur un système ouvert."
    },
    {
      "id": "ax_gravite",
      "type": "axiome",
      "nom": "Pesanteur uniforme",
      "enonce": "𝐠 = −g 𝐞_y, g = 9,81 m·s⁻² ; y est l’altitude comptée depuis le haut du tas.",
      "sous_probleme": "cadre",
      "origine": "humain",
      "admis": true,
      "source": "Mécanique classique."
    },
    {
      "id": "lt_chainette",
      "type": "lemme",
      "nom": "Équilibre d’une chaîne statique",
      "enonce": "Une chaîne statique souple sous pesanteur uniforme vérifie T − λ g y = constante ; sa forme est une chaînette.",
      "sous_probleme": "cadre",
      "origine": "humain",
      "utilise": [
        "ax_gravite"
      ],
      "admis": true,
      "source": "Résultat classique de statique des fils."
    },
    {
      "id": "lt_buckingham",
      "type": "lemme",
      "nom": "Théorème de Vaschy–Buckingham",
      "enonce": "Une loi physique s’écrit entre grandeurs sans dimension ; ici h₁/h₂ ne peut dépendre que de α et β.",
      "sous_probleme": "cadre",
      "origine": "humain",
      "admis": true,
      "source": "Analyse dimensionnelle (Vaschy 1892, Buckingham 1914)."
    },
    {
      "id": "h_inext",
      "type": "hypothese",
      "nom": "Chaîne inextensible",
      "enonce": "Maillons de longueur fixe, masse linéique λ uniforme, section négligeable.",
      "sous_probleme": "cadre",
      "origine": "humain"
    },
    {
      "id": "h_stat",
      "type": "hypothese",
      "nom": "Régime stationnaire",
      "enonce": "Dans le référentiel du laboratoire, la forme de la fontaine est fixe et la chaîne la parcourt à vitesse constante v.",
      "sous_probleme": "cadre",
      "origine": "humain"
    },
    {
      "id": "h_etroite",
      "type": "hypothese",
      "nom": "Fontaine étroite",
      "enonce": "Les deux jambes sont quasi verticales et proches : au sommet, le rayon de courbure est petit devant h₁.",
      "sous_probleme": "cadre",
      "origine": "humain"
    },
    {
      "id": "def_hauteurs",
      "type": "definition",
      "nom": "Hauteurs h₁ et h₂",
      "enonce": "h₁ : hauteur du sommet au-dessus du tas ; h₂ : chute du tas jusqu’au sol.",
      "sous_probleme": "cadre",
      "origine": "humain",
      "admis": true,
      "source": "Biggins et Warner, Proc. R. Soc. A 470 (2014)."
    },
    {
      "id": "def_t_eff",
      "type": "definition",
      "nom": "Tension effective",
      "enonce": "T′ = T − λ v² : pour une chaîne en mouvement stationnaire, tension d’une chaîne statique de même forme.",
      "sous_probleme": "cadre",
      "origine": "humain",
      "utilise": [
        "h_stat"
      ],
      "admis": true,
      "source": "Biggins et Warner, Proc. R. Soc. A 470 (2014)."
    },
    {
      "id": "def_alpha",
      "type": "definition",
      "nom": "Coefficient de prise α",
      "enonce": "Fraction de λ v² fournie par la réaction du tas au point de prise : T₀ = (1 − α) λ v².",
      "sous_probleme": "cadre",
      "origine": "humain",
      "admis": true,
      "source": "Biggins et Warner, Proc. R. Soc. A 470 (2014)."
    },
    {
      "id": "def_beta",
      "type": "definition",
      "nom": "Coefficient d’arrivée β",
      "enonce": "Tension résiduelle au sol : T_s = β λ v² (β = 0 pour un arrêt parfaitement inélastique).",
      "sous_probleme": "cadre",
      "origine": "humain",
      "admis": true,
      "source": "Biggins et Warner, Proc. R. Soc. A 470 (2014)."
    },
    {
      "id": "ch_souple",
      "type": "choix_modelisation",
      "nom": "Chaîne parfaitement souple",
      "enonce": "Courbe continue sans rigidité de flexion ni de torsion.",
      "sous_probleme": "cadre",
      "origine": "humain",
      "utilise": [
        "h_inext"
      ],
      "choix": {
        "hypothese": "La chaîne est une courbe continue parfaitement souple.",
        "portee": "Équation du mouvement le long de la chaîne (SP1).",
        "alternatives": [
          "Maillons rigides articulés discrets",
          "Tige élastique avec rigidité de flexion"
        ]
      }
    },
    {
      "id": "ch_air",
      "type": "choix_modelisation",
      "nom": "Frottement de l’air négligé",
      "enonce": "Aucune force aérodynamique sur la chaîne.",
      "sous_probleme": "cadre",
      "origine": "ia",
      "choix": {
        "hypothese": "La traînée de l’air est négligeable devant le poids et les forces de contact.",
        "portee": "Tout le bilan de forces (SP1, SP2).",
        "alternatives": [
          "Traînée quadratique ∝ ρ_air C_x v²"
        ]
      }
    },
    {
      "id": "ch_sol",
      "type": "choix_modelisation",
      "nom": "Arrivée au sol paramétrée par β",
      "enonce": "Le contact avec le sol est résumé par T_s = β λ v².",
      "sous_probleme": "cadre",
      "origine": "humain",
      "utilise": [
        "def_beta"
      ],
      "choix": {
        "hypothese": "Le sol arrête la chaîne en ne lui laissant qu’une tension β λ v².",
        "portee": "Condition au pied de la jambe descendante (SP2).",
        "alternatives": [
          "Modèle de choc maillon par maillon"
        ]
      }
    },
    {
      "id": "obs_mould",
      "type": "observation",
      "nom": "La chaîne monte au-dessus du bécher",
      "enonce": "Une chaîne de billes de 50 m tirée par-dessus le bord d’un bécher s’élève au-dessus de celui-ci avant de tomber (Mould, 2013).",
      "sous_probleme": "cadre",
      "origine": "humain"
    },
    {
      "id": "conj_elan",
      "type": "conjecture",
      "nom": "L’élan de la chaîne suffit",
      "enonce": "Sans aucune réaction du tas (α = 0), l’élan acquis par la chaîne suffirait à la faire monter au-dessus du bécher.",
      "sous_probleme": "billes",
      "origine": "ia",
      "abandonne": true,
      "demonstrations": [
        {
          "nom": "Heuristique",
          "premisses": {
            "contexte": [
              "obs_mould"
            ]
          },
          "validite": "invalide",
          "confiance": 0.08,
          "verifie_par": [
            "ia"
          ],
          "auteur": "directeur_de_labo"
        }
      ]
    },
    {
      "id": "l_mouv",
      "type": "lemme",
      "nom": "Équation du mouvement stationnaire",
      "enonce": "∂ₛ(T 𝐭) − λ v² κ 𝐧 + λ𝐠 = 𝟎, où s est l’abscisse curviligne, κ la courbure et 𝐧 la normale.",
      "sous_probleme": "dyn",
      "origine": "humain",
      "demonstrations": [
        {
          "nom": "Démonstration",
          "premisses": {
            "principale": [
              "ax_newton"
            ],
            "auxiliaire": [
              "ch_souple",
              "ch_air"
            ],
            "contexte": [
              "ax_gravite",
              "h_inext",
              "h_stat"
            ]
          },
          "validite": "valide",
          "confiance": 0.91,
          "verifie_par": [
            "humain"
          ],
          "auteur": "camille"
        }
      ]
    },
    {
      "id": "l_effective",
      "type": "lemme",
      "nom": "Réduction à un problème statique",
      "enonce": "Avec T′ = T − λ v² : ∂ₛ(T′ 𝐭) + λ𝐠 = 𝟎. La fontaine a la forme d’une chaîne statique de tension T′.",
      "sous_probleme": "dyn",
      "origine": "humain",
      "demonstrations": [
        {
          "nom": "Démonstration",
          "premisses": {
            "principale": [
              "l_mouv"
            ],
            "contexte": [
              "def_t_eff"
            ]
          },
          "validite": "valide",
          "confiance": 0.91,
          "verifie_par": [
            "ia",
            "humain"
          ],
          "auteur": "camille"
        }
      ]
    },
    {
      "id": "l_conserv",
      "type": "lemme",
      "nom": "Invariant le long de la chaîne",
      "enonce": "T′ − λ g y est constant le long de toute la chaîne, du tas jusqu’au sol.",
      "sous_probleme": "dyn",
      "origine": "ia",
      "demonstrations": [
        {
          "nom": "Démonstration",
          "premisses": {
            "principale": [
              "l_effective"
            ],
            "technique": [
              "lt_chainette"
            ]
          },
          "validite": "valide",
          "confiance": 0.91,
          "verifie_par": [
            "humain"
          ],
          "auteur": "directeur_de_labo"
        }
      ]
    },
    {
      "id": "p_forme",
      "type": "proposition",
      "nom": "Forme : chaînette inversée",